id;lyrics;title;url
3189533;"Letra de ""Silencio""[Verso 1]
Todo el mundo intentando venderte algo
Intentando comprarte
Queriendo meterte en su melodrama
Su karma, su cama, su salto a la fama
Su breve momento de gloria
Sus dos megas de memoria
Subirte a su nube
Como un precio que sube
Para luego exhibirte
Como un estandarte
No encuentro nada más valioso que darte
Nada más elegante
Que este instante
De silencio
[Hook]
<a annotation-fragment=""12572719"" class=""referent"" classification=""accepted"" data-id=""12572719"" href=""/Jorge-drexler-silencio-lyrics#note-12572719"" image=""false"" ng-class=""{
          'referent--linked_to_preview': song_ctrl.referent_has_preview(fragment_id),
          'referent--linked_to_preview_active': song_ctrl.highlight_preview_referent(fragment_element_id),
          'referent--purple_indicator': song_ctrl.show_preview_referent_indicator(fragment_element_id)
        }"" ng-click=""open()"" on-hover-with-no-digest=""set_current_hover_and_digest(hover ? fragment_id : undefined)"" pending-editorial-actions-count=""0"" possibly-branded=""false"" prevent-default-click="""">Silencio
[Verso 2]
El índice vertical entre la boca y la nariz
El eco en la catedral
La brisa en la enredadera
Entremos en el sonido hasta el penúltimo matiz
Hagámosle caso al gesto de la foto de la enfermera
Y cuando el ruido vuelva a saturar la antena
Y una sirena rompa la noche, inclemente
No encontraremos nada más pertinente
Que decirle a la mente
Detente
[Hook]
<a annotation-fragment=""12572719"" class=""referent"" classification=""accepted"" data-id=""12572719"" href=""/Jorge-drexler-silencio-lyrics#note-12572719"" image=""false"" ng-class=""{
          'referent--linked_to_preview': song_ctrl.referent_has_preview(fragment_id),
          'referent--linked_to_preview_active': song_ctrl.highlight_preview_referent(fragment_element_id),
          'referent--purple_indicator': song_ctrl.show_preview_referent_indicator(fragment_element_id)
        }"" ng-click=""open()"" on-hover-with-no-digest=""set_current_hover_and_digest(hover ? fragment_id : undefined)"" pending-editorial-actions-count=""0"" possibly-branded=""false"" prevent-default-click="""">Silencio
Silencio
Shh, shh, shh
Shh, shh, shh, shhhh
Shh, shh, shh
Shh, shh, shh, shhhh
[Puente]
Bésame ahora
Antes que diga algo completamente inadecuado
No hay que desperdiciar una buena ocasión
De quedarse callado
[Hook]
<a annotation-fragment=""12572719"" class=""referent"" classification=""accepted"" data-id=""12572719"" href=""/Jorge-drexler-silencio-lyrics#note-12572719"" image=""false"" ng-class=""{
          'referent--linked_to_preview': song_ctrl.referent_has_preview(fragment_id),
          'referent--linked_to_preview_active': song_ctrl.highlight_preview_referent(fragment_element_id),
          'referent--purple_indicator': song_ctrl.show_preview_referent_indicator(fragment_element_id)
        }"" ng-click=""open()"" on-hover-with-no-digest=""set_current_hover_and_digest(hover ? fragment_id : undefined)"" pending-editorial-actions-count=""0"" possibly-branded=""false"" prevent-default-click="""">Silencio
Shh, shh, shh
Shh, shh, shh, shhhh
Shh, shh, shh
Shh, shh, shh, shhhh
[Verso 2]
Y cuando el ruido vuelva a saturar la antena
Y una sirena rompa la noche, inclemente
No encontraremos nada más pertinente
Que decirle a la mente
<a annotation-fragment=""12572777"" class=""referent"" classification=""accepted"" data-id=""12572777"" href=""/Jorge-drexler-silencio-lyrics#note-12572777"" image=""false"" ng-class=""{
          'referent--linked_to_preview': song_ctrl.referent_has_preview(fragment_id),
          'referent--linked_to_preview_active': song_ctrl.highlight_preview_referent(fragment_element_id),
          'referent--purple_indicator': song_ctrl.show_preview_referent_indicator(fragment_element_id)
        }"" ng-click=""open()"" on-hover-with-no-digest=""set_current_hover_and_digest(hover ? fragment_id : undefined)"" pending-editorial-actions-count=""0"" possibly-branded=""false"" prevent-default-click="""">Detente
[Hook]
Silencio
Silencio
Silencio
Silen-
Silencio
Silen-
Silencio
-cio
Silen-
Silencio
";Silencio;https://genius.com/Jorge-drexler-silencio-lyrics
1261098;"Soledad
Aqui están mis credenciales
Vengo llamando a tu puerta
Desde hace un tiempo
Creo que pasaremos juntos temporales
Propongo que tú y yo nos vayamos conociendo
Aquí estoy
Te traigo mis cicatrices
Palabras sobre papel pentagramado
No te fijes mucho en lo que dicen
Me encontrarás
En cada cosa que he callado
Ya pasó
Ya he dejado que se empañe
La ilusión de que vivir es indoloro
Que raro que seas tú
Quien me acompañe, soledad
A mi que nunca supe bien
Cómo estar solo
";Soledad;https://genius.com/Jorge-drexler-soledad-lyrics
1068877;"Escuchen tocar al tamborero
Luna llena de cuero es la lonja de su tambor
Escuchen tocar al tamborero
Luna llena de cuero es la lonja de su tambor
El padre del padre del tamborero
Le esta contando a su nieto
La historia de aquel tambor
Como le contó a su padre su abuelo
Que dicen le había contado a él, su hermano mayor
La historia que es larga y a veces es triste
Resiste si se descarga en cada generación
La historia que no se cuenta en palabras
Tampoco voy a contarla yo
En esta canción
Para eso escuchen tocar al tamborero
Luna llena de cuero es la lonja de su tambor
Escuchen tocar al tamborero
Luna llena de cuero es la lonja de su tambor
La historia que un día el tamborero
Tocando el tambor le cuenta también
A su hijo mayor
La historia en vez de unos y ceros
Se cuenta en madera y cuero tensado por el calor
Y así va pasando de boca en boca
De mano en mano que toca
De corazón en corazón
Historia que suena es la del candombe
Y si se preguntan donde esta viva la tradición:
Escuchen tocar al tamborero
Luna llena de cuero es la lonja de su tambor
Escuchen tocar al tamborero
Luna llena de cuero es la lonja de su tambor
";Tamborero;https://genius.com/Jorge-drexler-tamborero-lyrics
967545;"Como un tatuaje desteñido
Me iré borrando de tu piel
Se irá mi última caricia
Decolorando, mes a mes
Dirás que fue la medianoche
Dirás, la luz de aquel color
Y en un segundo de descuido
Recobrarás mi corazón
Hay un dolor abandonado
En el rincón de nunca más
Una pasión de utilería
Que ya no sirve recordar
Dirás que fue la madrugada
Por la ventana el resplandor
Y en un segundo de desvelo
Comprenderás esta canción
";Tatuaje;https://genius.com/Jorge-drexler-tatuaje-lyrics
3154927;"Letra de ""Telefonía""[Verso 1]
Que viva la telefonía
En todas sus variantes
Pensando estaba que te me escabullías
Cuando vi tu nombre en la llamada entrante
Bendita cada onda, cada cable
Bendita radiación de las antenas
Mientras sea tu voz la que me hable
Como me hablaste hace un minuto apenas
[Estribillo]
Te quiero, te querré, te quise siempre
Desde antes de saber que te quería
Te dejo este mensaje simplemente
Para repetirte algo que yo sé que vos sabías
[Verso 2]
Perdonen que insista en elogiar las telecomunicaciones
Aunque todos creen
Que han inventado algo
Y siguen siendo las mismas las canciones
Benditos los rollos de papiro
Benditas servilletas de los bares
Que han guardado idénticos suspiros
Desde el cantar de los cantares
[Estribillo]
Te quiero, te querré, te quise siempre
Desde antes de saber que te quería
Te dejo este mensaje simplemente
Para repetirte algo que yo sé que vos sabías
[Verso 3]
Noches en vela, nombres en clave
Cuántos secretos, versos galantes
Mil confesiones delirantes
Pasan milenios, cambian los nombres de los amantes
Cambian el atuendo, pero el mensaje sigue siendo
[Estribillo]
Te quiero, te querré, te quise siempre
Desde antes de saber que te quería
Te dejo este mensaje simplemente
Para repetirte algo que yo sé que vos sabías
";Telefonía;https://genius.com/Jorge-drexler-telefonia-lyrics
1668519;"Te vi llegar
Y así sin mas
Desatar mi antifaz
Dejé el disfraz en un rincón
Se acabó la función
Mi corazón se dejó hacer
Y el telón caer
Mientras tanto en algún otro lugar
Dos hilos cruzan juntos otro telar
";Telón;https://genius.com/Jorge-drexler-telon-lyrics
1984556;"Todo Cae
Tarde o temprano
A pesar de que por un lapso de tiempo
El suelo parezca infinitamente lejano
Todo cae, todo caerá hacia su centro
Todo cuerpo por mas ingenioso
Viaja al encuentro
De su reposo
Todo cae
Quién lo diría
Cuando en un breve lapso
De levedad
Tu amor vence a la gravedad y a la entropía
Todo cae
Todo caerá y sin embargo
Flota
Mientras tanto esta nota
En algún pentagrama
Leve
Y al compás de ese breve sonido un planeta
Gira
Y una planta respira y el aire caliente
Sube
Y el vapor de una nube destila una gota
Que oscila un instante reacia
Y hacia el suelo cae
Tarde o temprano
A pesar de que por un lapso de tiempo
El suelo parezca infinitamente lejano
Todo cae, todo caerá hacia su centro
Todo cuerpo por mas ingenioso
Viaja al encuentro
De su reposo
Todo cae
Quién lo diría
Cuando en un breve lapso
De levedad
Tu amor vence a la gravedad
Y a la entropía
Todo cae
Todo caerá y sin embargo
Flota
Mientras tanto esa nota
En algún pentagrama
Leve
Y al compás de ese breve sonido un planeta
Gira
Y una planta respira y el aire caliente
Sube
Y el vapor de una nube destila una gota
Que oscila un instante reacia
Y hacia el suelo cae
Tarde o temprano
";Todo cae;https://genius.com/Jorge-drexler-todo-cae-lyrics
1054862;"Claro que lo sé
Lo tengo más que claro
Los días raros son muchos
Y los días buenos, raros
Duró la efímera rosa
Lo que duran los suspiros
Lo que una mariposa
Dura fuera del retiro
Y aunque no haya una razón
Todos a sus puestos
La vida puede que no
Se ponga mucho mejor que esto
Por una vez que no duele
Todo el mundo a bordo
Que la pena cante hoy
En oídos sordos
Claro que también
Melancolía manda
Con su pluma minuciosa
Deshace afanosa
Lo que uno anda
Dejemos que esa nostalgia
Nos bese la cara seca
Como el Sol de los domingos
Besa la plaza de chueca
Y aunque no haya una razón
Todos a sus puestos
La vida puede que no
Se ponga mucho mejor que esto
Por una vez que no duele
Todo el mundo a bordo
Que la pena cante hoy
En oídos sordos
Que la pena cante hoy
En oídos sordos
";Todos a Sus Puestos;https://genius.com/Jorge-drexler-todos-a-sus-puestos-lyrics
1002897;"Tu beso se hizo calor
Luego el calor, movimiento
Luego gota de sudor
Que se hizo vapor, luego viento
Que en un rincón de La Rioja
Movió el aspa de un molino
Mientras se pisaba el vino
Que bebió tu boca roja
Tu boca roja en la mía
La copa que gira en mi mano
Y mientras el vino caía
Supe que de algún lejano rincón
De otra galaxia
El amor que me darías
Transformado, volvería
Un día a darte las gracias
Cada uno da lo que recibe
Y luego recibe lo que da
Nada es más simple
No hay otra norma:
Nada se pierde
Todo se transforma
El vino que pagué yo
Con aquel euro italiano
Que había estado en un vagón
Antes de estar en mi mano
Y antes de eso en Torino
Y antes de Torino, en Prato
Donde hicieron mi zapato
Sobre el que caería el vino
Zapato que en unas horas
Buscaré bajo tu cama
Con las luces de la aurora
Junto a tus sandalias planas
Que compraste aquella vez
En Salvador de Bahía
Donde a otro diste el amor
Que hoy yo te devolvería
Cada uno da lo que recibe
Y luego recibe lo que da
Nada es más simple
No hay otra norma:
Nada se pierde
Todo se transforma
Todo se transforma
Todo se transforma
Todo se transforma
Supe que de algún lejano rincón
De otra galaxia
El amor que me darías
Transformado, volvería
Un día a darte las gracias
Porque cada uno da lo que recibe
Y luego recibe lo que da
Nada es más simple
No hay otra norma:
Nada se pierde
Todo se transforma
Nada se pierde
Todo se transforma
Nada se pierde
Todo se transforma
Todo se transforma
Todo se transforma
Todo se transforma
Todo se transforma
";Todo se transforma;https://genius.com/Jorge-drexler-todo-se-transforma-lyrics
1564353;"En tu propia fuente llorará la luna
Con lágrimas hechas de gotas de seda
Haciendo que pese la bruma en la bruma
En la soledad del toque de queda
En la soledad del toque de queda
La mano que toca, queda suspendida
A medio suspiro, apenas, del beso
Gemido a gemido se abre la herida
Y la noche cae por su propio peso
Y la noche cae por su propio peso
Por cada rendija
El tiempo vuelve a las casas
Como una humareda...
En la soledad del toque de queda
Una lengua extraña murmura su precio
Y otra lengua paga, moneda a moneda
Cada trapecista suelta su trapecio
En la soledad del toque de queda
En la soledad del toque de queda
";Toque de Queda;https://genius.com/Jorge-drexler-toque-de-queda-lyrics
862636;"Voy en este vuelo transoceánico
Oyendo tus versos melancólicos
Dejando que el sonido de tu voz
Te traiga, así
Del modo más enérgico
Me regalaste tus somníferos
Me diste tu oráculo sintético
Extraño método
De ahogar la sed, aquí
Lejos de tu lágrima
Y uno no recuerda
Hasta que punto
Nació para eso
Ni todo el amor
Al que puede tener
Acceso
Nada parece pasar página
A este anhelo
Todo menos lánguido
¿Cual es la lógica de que se
Abra para mí
Tu boca tan magnífica?
Dame calma y dame vértigo
Ven a llenar mis pocas horas lúcidas
Extraño método
De ahogar la sed, aquí
Lejos de tu lágrima
";Transoceánica;https://genius.com/Jorge-drexler-transoceanica-lyrics
1762376;"Desde ahora mismo y aquí
Hacia donde quiera que estés
Parte de mi alma
Parte a tu encuentro
Sabes que te llevo dentro mío
Igual que yo sé que tu me llevas dentro
Se trata de un leve pulsar
Que se abre camino hacia tí
Cruzando las estaciones, constelaciones
Los momentos
Digo que esta vida es llevadera
Sólo porque sientes tú
Lo que yo siento
Donde tu estás
Yo tengo el Norte
Y no hay nada como tu amor
Como medio de transporte
En este instante
Precisamente
Más canto y mas te tengo yo
Presente
Más te tengo yo presente
";Transporte;https://genius.com/Jorge-drexler-transporte-lyrics
1033827;"Estoy aquí de paso
Yo soy un pasajero
No quiero llevarme nada
Ni usar el mundo de cenicero
Estoy aquí sin nombre
Y sin saber mi paradero
Me han dado alojamiento
En el mas antiguo de los viveros
Si quisiera regresar
Ya no sabría hacia donde...
Pregunto al jardinero
Y el jardinero no me responde
Hay gente que es de un lugar
No es mi caso
Yo estoy aquí
De paso
¿El mar moverá la luna
O la luna a las mareas?
¿Se nace lo que se es
O se será aquello lo que se crea?
Yo estoy aquí, perplejo
No soy más que todo oídos
Me quedo, con mucha suerte
Tres mil millones de mis latidos
Si quisiera regresar
Ya no sabría hacia cuando...
El mismo jardinero
Debe estárselo preguntando
Hay gente que es de un lugar
No es mi caso
Yo estoy aquí
De paso
";Tres Mil Millones de Latidos;https://genius.com/Jorge-drexler-tres-mil-millones-de-latidos-lyrics
1541952;"Onda de mar
En que flota este blues
Tu...
Toma este vals
Que no supe esconder
Tu...
Tienes la culpa
De este bolero
Que se ha adueñado de mí...
No he visto azul
Más azul que cuando miras
Tu...
Esta canción
Quiere estár donde estés
Tu...
Y si es necesario
La canto en inglés
You...
You are to blame
For this bolero
That has gone right to my head...
No he visto blue
Más azul que cuando miras
Tu...
";Tú;https://genius.com/Jorge-drexler-tu-lyrics
1758200;"Tu piel, tu piel, tu piel, tu piel, tu piel
Buscando desde el aire
Besar tu piel, sentir tu piel besándome
Tropel de viejas novedades
La vi brillar, yo vi tu piel brillar
De un blanco que quemaba
Buscándote, buscándote, buscándome
Entre la bruma tibia del cuarto
Cerrar tus ojos y escucharle desvestir
Sonando tus pulseras
Y tintineando por la oscuridad
Tu mano pasa y deja una estela de luz
Luz, calor, tu pecho es guirnalda
Sólo quiero empapar mi cara en tu piel, tu piel, tu piel…
";Tu piel;https://genius.com/Jorge-drexler-tu-piel-lyrics
1460887;"Cuando la noche pasea
Más allá de mi pretil
Yo puedo ver para afuera
Sin que me veas a mí
Yo puedo ver la luz
Yo puedo ver tu piel
Yo puedo ver tu ropa caer
Yo puedo adivinar
La nube de vapor
Que tiene el aire a tu alrededor
Yo tengo un vicio barato
Y antes que nada, legal
Gozo del anonimato
Que me da la oscuridad
Y no voy a interferir
Con tu respiración
No voy a entrar en tu corazón
No te quiero tocar
No te puedo querer
Yo te diré lo que quiero ser: tu voyeur
Tu voyeur, tu voyeur, tu voyeur…
Ya me aprendí tus horarios
Y el orden de tu placard
Ya te crucé por el barrio
No pude más que recordar
(mirándote al espejo
A toalla en el sofá
Peinándote con tranquilidad
Sin sospechar que yo
Del otro lado de
La calle estaba muriéndome)
Cuando la noche pasea
Más allá de mi pretil
Yo puedo ver para afuera
Sin que me veas a mí
Tu voyeur, tu voyeur, tu voyeur
";Tu voyeur;https://genius.com/Jorge-drexler-tu-voyeur-lyrics
888803;"Varias primaveras atrás
El viento cambió
Y una canción
Me trajo hasta aquí
No fue más que un signo sutil
Que luego creció
Y una canción
Me trajo hasta aquí
Antes, antes
En aquel otro mundo distante
En tiempos de otro cantar
Lejos, lejos
Con la mirada en otros espejos
Sin darme cuenta
Un día eché a andar
Con una ilusión infantil
Que dura hasta hoy
Una canción
Me trajo hasta aquí
Fui dejando versos detrás
Renglón a renglón:
Una canción
Me trajo hasta aquí
";Una Canción Me Trajo Hasta Aquí;https://genius.com/Jorge-drexler-una-cancion-me-trajo-hasta-aqui-lyrics
1193356;"Lleno de naranjas un barco navega
Lleno de naranjas un barco navega
El viento gigante sopla en sus velas
El viento gigante sopla en sus velas
Sopla en sus velas el viento del este
Sopla en sus velas el viento del este
Llegan a una playa, blanca y transparente
Llegan a una playa, blanca y transparente
Navega barco velero
Deja que los niños te llenen de sueños
Navega barco de oro
Deja que los niños guarden tu tesoro
Barco navega y encalla en la playa
Barco navega y encalla en la playa
El rey le saluda, desde su atalaya
El rey le saluda, desde su atalaya
El rey le ha pedido mientras le saluda
El rey le ha pedido mientras le saluda
Dame una naranja y el ritmo de cuba
Dame una naranja y el ritmo de cuba
Navega barco velero
Deja que los niños te llenen de sueños
Navega barco de oro
Deja que los niños guarden tu tesoro
(...)
";Un barco de sueños;https://genius.com/Jorge-drexler-un-barco-de-suenos-lyrics
1973448;"Mi anhelo no está
Mi anhelo se fue detrás de ti siguiéndote
Por la avenida
A vuelto ha pasar
Mi anhelo volvió a tomar su propia decisión
Independiente de la mía
Qué le voy hacer
Se trata de ti
Y en eso él y yo
Vos ya lo sabes
Opinamos diferente
Yo contigo mantengo las distancias
Mi anhelo las rompe alegremente
Llévate del aire el perfume de tu pelo
No ves que yo no sé qué hacer
Con mis dos universos paralelos
Mi anhelo no está
Mi anhelo se fue detrás de ti siguiéndote
Por la avenida
A vuelto ha pasar
Mi anhelo volvió a tomar su propia decisión
Independiente de la mía
Qué le voy hacer
Se trata de ti
Y en eso él y yo
Vos ya lo sabes
Opinamos diferente
Yo contigo mantengo las distancias
Mi anhelo las rompe alegremente
Llévate del aire el perfume de tu pelo
No ves que yo no sé qué hacer
Con mis dos universos paralelos
Colapso seguro que colapso
Cada vez que chocamos un vacío inmediato
De esta falta de gravedad
Como un cuerpo flotando en soledad
Y aquí tu efecto gravitatorio
Deje girando un desorden notorio
En mi universo equidistante
Donde mi amor en órbita cae
Caen estrellas
Caen las estrellas completas el cosmos perdido
Que busca tu huella
De esta lazo satelital de esta fuerza universal
Voy un paso adelante un golpe seguro y un beso distante
Yo te quiero mi amor de manera importante
Y mi puesto va vigilante
Llévate del aire el perfume de tu pelo
Llévate del aire el perfume de tu pelo
Llévate del aire el perfume de tu pelo
Llévate del aire el perfume de tu pelo
No ves que yo no sé qué hacer
Con mis dos universos paralelos
";Universos paralelos;https://genius.com/Jorge-drexler-universos-paralelos-lyrics
1452641;"Hazme un lugar en tu almohada
Junto a tu pecho me calmaré
Hazme un lugar en tu almohada
Para que duermas yo te cantaré
Una canción de cuna
Un valsecito de Tacuarembó
Te ira llevando en una nube
Si no me duermo antes yo
Hay un rincón en tu pelo
En el que yo me perfumaré
Hay un rincón en tu pelo
Sobre la almohada esperándome
Una cascada azul
Como la sombra de un jacarandá
Me iré acercando a tu mejilla
Para escucharte respirar
";Un lugar en tu almohada;https://genius.com/Jorge-drexler-un-lugar-en-tu-almohada-lyrics
1522888;"Tanto sumar y tanto correr
Sin ir a lugar ninguno
Quiero quedarme
Y contigo, sentirme uno
Quiero ser uno con tu sonrisa
Llevarte el desayuno
Para tu amor
Como el mío no encontrarás ninguno
Uno da vueltas
Buscando el momento más oportuno
Para pedirte que de tus besos me des alguno
Amar es eso dos corazones latiendo al compás de uno
Tanto fumar y tanto reír
Y tanto mirar tu boca
¡Como quisiera ser aire, del aire que te toca!
Quiero ser uno con tu tristeza
Y uno con tu alegría
Quiero que aun sigas conmigo
Cuando se haga de día
Uno da vueltas
Buscando el momento de dar el paso
No hay nada que no daría
Por estar dentro de tu abrazo
Amar es eso
Dos corazones bebiendo de un mismo vaso
Tanto sumar y tanto correr
Sin ir a lugar ninguno
Quiero quedarme
Y contigo, sentirme uno
";Uno;https://genius.com/Jorge-drexler-uno-lyrics
1591307;"Vengo de un prado vacío
Un país con el nombre de un río
Un edén olvidado
Un campo al costado del mar
Pocos caminos abiertos
Todos los ojos en el aeropuerto
Unos años dorados
Un pueblo habituado a añorar
Como me cuesta quererte
Me cuesta perderte
Me cuesta olvidar
El olor de la tierra mojada
La brisa del mar...
Brisa del mar, llevame hasta mi casa
Un sueño y un pasaporte
Como las aves buscamos el norte
Cuando el invierno se acerca y el frio
Comienza a apretar
Y este es un invierno largo
Van varios lustros en tragos amargos
Y nos hicimos mayores
Esperando las flores del jacaranda
Como me cuesta marcharme
Me cuesta quedarme
Me cuesta olvidar
El olor de la tierra mojada
La brisa del mar...
Brisa del mar, llevame hasta mi casa, brisa del mar....
";Un país con el nombre de un río;https://genius.com/Jorge-drexler-un-pais-con-el-nombre-de-un-rio-lyrics
1053846;"Mírenla salir sobre la marea
Nadie que la ve cree que sea
De veras
Mírenla colgar sobre la bahía
El que no la vio nunca
Entendería
Su piel de un solo color
La luz que sabe robar
La estela de resplandor
Que va dejando en el mar
";Un solo color;https://genius.com/Jorge-drexler-un-solo-color-lyrics
3157510;"Quién le roba un beso a Maracaná?
Uruguay nomás
Uruguay nomás
No seremos muchos
pero somos dueños de nuestros anhelos,
y tenemos el alma del mismo color que el cielo
Quien dijo que no se podía
soñar, cueste lo que cueste?
Quien dijo que el cielo no era celeste?
Y quién le roba un beso a Maracaná?
Uruguay nomás
Uruguay nomás
No seremos muchos
pero si se complican las cosas
nos vamos arriba aunque sople el viento en contra.
Se gane o se vaya perdiendo,
peleando, pase lo que pase,
quien suelta en el cielo del Sur 11 estrellas fugaces?
Y quién le roba un beso a Maracaná?
Uruguay nomás
Uruguay nomás
";Uruguay nomás;https://genius.com/Jorge-drexler-uruguay-nomas-annotated
1618541;"Tu caricia no me afecta
Yo la puedo tolerar
Sin mover una pestaña
Sin parar de controlar
Cada cosa que digo
Ningún gesto de más
De lo que pase aquí dentro
No te vas a enterar
El desgrana moralejas
Y analiza el porvenir
Está jurando que la quiere
Que no se va a repetir
No me rindo tan fácil
Ya me supo doler
No me cuentes el premio
Que no voy a caer
Ya no más de tu vaivén
No ves que ya está
No tiene revés
Ya no puedo recobrar
Aquella emoción
Se desdibujó
";Vaivén;https://genius.com/Jorge-drexler-vaiven-lyrics
903360;"Tomé de un trago el veneno
De esos ojos de mujer
Seguí su canto en las rocas
Un descuido y naufragué
Y hoy sólo fumo callado
Cuando escucho hablar de amor
De ese fruto codiciado
Yo ya conozco el sabor
No vi la red escondida
La trampa esperándome
Creí sincera su entrega
Y por entero me entregué
Pero eso fue hace ya mucho
Ya aprendí de mi dolor
Y hoy sólo fumo y escucho
Cuando siento hablar de amor
";Veneno;https://genius.com/Jorge-drexler-veneno-lyrics
1665746;"Volando voy
Volando vengo
Volando voy
Volando vengo, vengo
Por el camino
Yo me entretengo
Por el camino
Yo me entretengo
Enamorao de la vida
Aunque a veces duela
Enamorao de la vida
Aunque a veces duela
Si tengo frío
Busco candela
Si tengo frío
Busco candela
Volando voy
Volando vengo
Por el camino
Yo me entretengo
Señoras y señores
Sepan ustedes
Señoras y señores
Sepan ustedes
Que es la flor de la noche
Es pa' quien la merece
Que es la flor de la noche
Es pa' quien la merece
Volando voy
Volando vengo
Por el camino
Yo me entretengo
Enamorao de la vida
Aunque a veces duela
Yo no sé quién soy
Ni lo pretendiera
Volando voy
Volando vengo
Por el camino
Yo me entretengo
Y es que a mi me va mucho
La marcha tropical
Y los cariños
En la frontera, me van
";Volando voy;https://genius.com/Jorge-drexler-volando-voy-lyrics
1422515;"Olvídame
Esta zamba te lo pide
Te pide mi corazón
Que no me olvides, que no me olvides
Deja el recuerdo caer
Como un fruto por su peso
Yo sé bien que no hay olvido
Que pueda más que tus besos
Yo digo que el tiempo borra
La huella de una mirada
Mi zamba dice no hay huella
Que dure mas en el alma
";Zamba del olvido;https://genius.com/Jorge-drexler-zamba-del-olvido-lyrics
