id;lyrics;title;url
1230721;"No somos mas
Que una gota de luz
Una estrella fugaz
Una chispa tan solo en la edad del cielo
No somos lo que quisieramos ser
Solo un breve latir
En un silencio antiguo con la edad del cielo
Coro:
Calma, todo esta en calma
Deja que el beso dure
Deja que el tiempo cure
Deja que el alma
Tenga la misma edad
Que la edad del cielo
No somos mas
Que un puñado de mar
Una broma de Dios
Un capricho del sol
Del jardin del cielo
No damos pie entre tanto tic tac
Entre tanto big bang
Solo un grano de sal
En el mar del cielo
Coro
";La edad del cielo;https://genius.com/Jorge-drexler-la-edad-del-cielo-lyrics
1600466;"Sobre mi mesa de luz, tu collar
Como una serpiente de plata agazapada
Dentro de cada eslabón se puede respirar
En el perfume, la huella de tu mirada
Pasó tu voz como un cometa
Por estas cuatro paredes mías
Quedó una luz, como una estela
Que el cuarto antes no conocía
Sobre el collar, un fulgor de plata
Una serpiente de luz que se contornea
Una huella de tu piel, un aro de calor
Que aquella noche olvidaste en mi cabecera
Nos vio dudar la luna nueva
Quemando miedos
En las cenizas
Nos vio girar como planetas
Tu pena, lejos, junto a la mía
N3om!x...
";La huella de tu mirada;https://genius.com/Jorge-drexler-la-huella-de-tu-mirada-lyrics
1857817;"Aquel mensaje que no debió haber leído
Aquel botón que no debió haber pulsado
Aquel consejo torpemente desoído
Aquel espacio, era un espacio privado
Pero no tuvo ni tendrá la sangre fría
Ni la mente clara y calculadora
Y aún creyendo saber en lo que se metía
Abrió una tarde aquella caja de pandora
Y la obsesión
Desencripta lo críptico
Viola lo mágico
Vence a la máquina;
Y tarde o temprano
Nada es secreto
En los vericuetos
De la informática
Leyó a mordiscos en un lapso clandestino
Tragando aquel dolor que se le atragantaba
Sintiendo claramente el riesgo, el desatino
De la pendiente aquella en la que se deslizaba
Y en tres semanas que parecieron años
Perdió las ganas de dormir y cinco kilos
Y en flashbacks de celos aún siguen llegando
Las frases que nunca debió haber leído
Y en esa espiral
La lógica duerme
Lo atávico al fin
Sale del reposo;
Y no hay contraseña
Prudencia, ni pin
Que aguante el embate
De un cracker celoso
";La Infidelidad De La Era Informatica;https://genius.com/Jorge-drexler-la-infidelidad-de-la-era-informatica-lyrics
1737867;"Mabel, dejó
El bolso con unas amigas
Y salió a bailar
Las luces violetas la protegían
Mintió la edad
Cruzando la pista vacía
Y lo abrazó
Sonaban las lentas lo permitían
Y la música siguió
Y la pista se llenó
Giraba conversando con él
Se habían visto alguna vez
Un baile en el club de Salinas
Los comentarios de rigor
Y la mano en la espalda la sostenía
Un mostrador
De mesas de salón de clase
La multitud
La luna de espejos giraba en el aire
Y la música ayudó
Vió la pista oscurecer
Su cuerpo recostándose en él
Mabel dudó
Pero no movió la mejilla
Y besó también
Fingiendo saber mientras aprendía
Y la música cambió
Y la pista despertándose
Y aquel perfume nuevo en la piel
";La luna de espejos;https://genius.com/Jorge-drexler-la-luna-de-espejos-lyrics
2007190;"Luna del Cabo
Boca de túnel
Lunar plateado
Sobre las nubes
Todos venimos a verte
Venimos de lejos a verte brillar
Blanca, creciente
Sacerdotisa
Palideciente
Sobre Valizas
Nadie se quiere perder
Nadie queda borracho sin verte salir
Roja, redonda
Mi cocumela
Fosforescente
Sobre la arena
Todos se miran perdidos
Se ríen, se mojan la ropa en el mar
";La luna del cabo;https://genius.com/Jorge-drexler-la-luna-del-cabo-lyrics
1949045;"Letra de ""La Luna de Rasquí""Yo miraba la luna de Rasquí
Tumbado en la arena blanca
Yo miraba la luna de Rasquí
Tumbado en la arena blanca
Y la luna me hablaba solo a mí
La luna me hablaba solo a mí
La luna me hablaba solo a mí
La luna me hablaba solo a mí
Me decía la luna de Rasquí
""Estás en arena santa""
Me decía la luna de Rasquí
""Estás en arena santa""
""Y la pena no llega hasta aquí""
""La pena no llega hasta aquí""
""La pena no llega hasta aquí""
""La pena no llega hasta aquí""
Yo miraba la luna de Rasquí
Tumbado en la arena blanca
Yo miraba la luna de Rasquí
Tumbado en la arena blanca
Y la luna me hablaba solo a mí
La luna me hablaba solo a mí
La luna me hablaba solo a mí
La luna me hablaba solo a mí
La luna, yo juraría
Me estaba hablando
La luna, yo juraría
Me estaba hablando
Como al Loco Juan Carabina
Las noches de San Fernando
Como al Loco Juan Carabina
Las noches de San Fernando
La pena, que todo lo ve
Con su microscopio
De desasosiego
La pena, aquí, creo que
¡Tiene un punto ciego!
Oh-oh-oh-oh-oh-oh-ohhhhh
Yo miraba la luna de Rasquí
Tumbado en la arena blanca
Yo miraba la luna de Rasquí
Tumbado en la arena blanca
Y la luna me hablaba solo a mí
La luna me hablaba solo a mí
La luna me hablaba solo a mí
La luna me hablaba solo a mí
Luna, luna, luna llena
Toma en tu mano, la mía
Luna, luna, luna llena
Toma en tu mano, la mía
Llévame a donde te canta
Mirándote, Simón Díaz
Llévame a donde te canta
Mirándote, Simón Díaz
(Tumbado en la arena blanca)
(Tumbado en la arena blanca)
(Tumbado en la arena blanca)
(Tumbado en la arena blanca)
Yo miraba la luna de Rasquí
Yo miraba la luna de Rasquí
Miraba la luna de Rasquí (Tumbado en la arena blanca)
";La Luna de Rasquí;https://genius.com/Jorge-drexler-la-luna-de-rasqui-lyrics
1548309;"Una nostalgia
Donde se condensa el rocío
Un paso en falso
Hacia un remolino en el río
Cualquier contrasentido
Hoy cobra sentido y se vuelve dilema
Para este corazón anhelante
Que hoy piensa sólo en la mitad faltante
Una insistente desazón
Que no entiende razones
Un cancionista
Que no entiende sus propias canciones
La mínima brisa como si fuera un ciclón
Desquicia la veleta
De este corazón sin paciencia
Que mira el cristal del freno de emergencia
Un acople, un sonido que da su propio sonido
Se realimenta
Una obsesión girando en su propia espiral
De nubes de tormenta
Todo puede ser
Tan peligrosamente leve
Como la nieve en la bola de nieve
";La Nieve en la Bola de Nieve;https://genius.com/Jorge-drexler-la-nieve-en-la-bola-de-nieve-lyrics
2006655;"Vine hasta el mar con la noche en la mira
Mis lentes de cerca, mi guitarra rota
Con una hoja en blanco, que en blanco quedaría
Intacta
Es que la noche no
La noche no es una ciencia exacta
Llamaba a la puerta con todas mis armas
Con algunos vicios, algunas virtudes
Pensé para mí que cumplía los pasos de un pacto
Pero la musa no pacta
Y la noche no
Es que la noche no
La noche no es una ciencia exacta
Yo debería a esta altura saberlo
Yo debería tenerlo ya claro en mis años
Una canción aparece de pronto
Y se clava en el alma
Como un cuerpo extraño
La soledad no traía canciones
Traía demonios, resaca, tormenta
Traía el extraño regalo de ser un eterno autotidacta
La noche no
Es que la noche no
La noche no es una ciencia exacta
La noche no
La noche no
Es que la noche no es una ciencia exacta
Hacer canciones no es una ciencia exacta
";La noche no es una ciencia;https://genius.com/Jorge-drexler-la-noche-no-es-una-ciencia-lyrics
1945620;"Que el pulso no me tiemble en el ultimo instante
Que el foco no pierda detalle de los dos amantes
Que no nos falte nunca el elixir dulce de la hipocresía
Que ahuyente las tinieblas el flash nuestro de cada día
Dios proveedor de las fotos robadas
Santo patrono de los paparazis
Haz que ella salga por la puerta adecuada
Que mire hacía aquí antes de entrar al taxi
Tú que creaste la prensa basura
Señor, bendice a este teleobjetivo
Concédeme el olfato, la caradura y la santa paciencia
De las que vivo
Que el pulso no me tiemble en el ultimo instante
Que el foco no pierda detalle de los dos amantes
Que no nos falte nunca el elixir dulce de la hipocresía
Que ahuyente las tinieblas el flash nuestro de cada día
Dios proveedor de las fotos robadas
Santo patrono de los paparazis
Haz que ella salga por la puerta adecuada
Que mire hacía aquí antes de entrar al taxi
Tú que creaste la prensa basura
Señor, bendice a este teleobjetivo
Concédeme el olfato, la caradura y la santa paciencia
De las que vivo
";La plegaria del paparazzo;https://genius.com/Jorge-drexler-la-plegaria-del-paparazzo-lyrics
1284757;"Mirando desde mi balcón las transeúntes
Haciendo de cuenta
Que estoy tomando apuntes
Y ella busca algo en su cartera
Y yo me digo: ya llegó la primavera
Y la maceta enfrente se llenó de brotes
Y allá abajo el barrio se llenó de escotes
Y la tarde se escapa verso adentro
Y yo sigo buscando sin encontrar mi centro
Y pongo ladrillo sobre ladrillo
Y sigo sin dar con el estribillo
(y entonces me pregunto)
¿Qué es lo que viste en mi?
¿Qué es lo que te hizo abrir así
Tus miedos, tus piernas, tu calendario
Las siete puertas sagradas de tu santuario
La extraña luz de tu cámara oscura
El infranqueable cerrojo de tu armadura?
Las transeúntes se han organizado
Tienen el deambular sincronizado
Y van haciendo su coreografía
Con las rodillas del color de la alegría
Cada farola tiene su bailarina
Y la banda viene entrando por la esquina
Y la tarde enseña la cintura
Y el tiempo enseña que hay cosas que no se curan
Y las musas huyen si las asedias
Y otra canción que va a quedar a medias
(y entonces me pregunto)
¿Qué es lo que viste en mi?
¿Qué es lo que te hizo abrir así
Tus miedos, tus piernas, tu calendario
Las siete puertas sagradas de tu santuario
La extraña luz de tu cámara oscura
El infranqueable cerrojo de tu armadura?
";Las Transeúntes;https://genius.com/Jorge-drexler-las-transeuntes-lyrics
1347743;"Camino por Madrid en tu compañía
Mi mano en tu cintura copiando a tu mano en la cintura mía
A paso lento, como bostezando
Como quien besa el barrio al irlo pisando
Como quien sabe que cuenta con la tarde entera
Sin nada más que hacer que acariciar aceras
Y sin planearlo tú, acaso
Como quien sin quererlo va y lo hace
Te vi cambiar tu paso hasta ponerlo en fase
En la misma fase que mi propio paso
Ir y venir
Seguir y guiar
Dar y tener
Entrar y salir de fase
Amar la trama, más que el desenlace
Amar la trama, más que el desenlace
Fue un salto ínfimo, disimulado
Un mínimo cambio de ritmo apenas
Un paso cambiado
Y dos cuerdas que resuenan
Como un mismo número en distintos dados
O el paso exacto de los soldados
Como dos focos intermitentes
Súbitamente así, sincronizados
Dos paseantes distraídos
Han conseguido que el reloj de arena
De la pena pare, que se despedace
Y así seguir el rumbo que el viento trace
Ir y venir
Seguir y guiar
Dar y tener
Entrar y salir de fase
Amar la trama, más que el desenlace
Amar la trama, más que el desenlace
Ir por ahí
Como en un film
De Eric Rohmer
Sin esperar que algo pase
Amar la trama, más que el desenlace
Amar la trama, más que el desenlace
Te vi cambiar tu paso hasta ponerlo en fase
En la misma fase que mi propio paso
Amar la trama, más que el desenlace
Amar la trama, más que el desenlace
Amar la trama, más que el desenlace
Camino por Madrid en tu compañía
";La Trama y el Desenlace;https://genius.com/Jorge-drexler-la-trama-y-el-desenlace-lyrics
3157514;"Letra de La Vida EnteraTu historia es tan antigua como las reglas del juego
Creció tu leyenda de hierro, de carbón y de fuego
Llenaste mil copas de un vino que el tiempo mejora
Y a ver, ahora, quién se anima a parar a esta locomotora?
Carbonero soy de tu caldera
Carbonero soy de tu caldera
Carbonero soy de tu caldera
Y seré, la vida entera
Y seré, la vida entera
Tu nombre fue cruzando cielos, cruzando fronteras
Como una golondrina que sigue volviendo cada primavera
Tu fuerza que inspira respeto, también enamora
Y a ver, ahora, quién se anima a parar a esta locomotora?
Carbonero soy de tu caldera
Carbonero soy de tu caldera
Carbonero soy de tu caldera
Y seré, la vida entera
Y seré, la vida entera
Hoy igual que ayer, aunque el tiempo pase
Una y otra vez, peñarol renace
Vean ondear las banderas, oigan su hinchada cantora
Echando carbón en la caldera de la locomotora
Carbonero soy de tu caldera
Carbonero soy de tu caldera
Carbonero soy de tu caldera
Y seré, la vida entera
Y seré, la vida entera
";La Vida Entera;https://genius.com/Jorge-drexler-la-vida-entera-annotated
1761604;"Llueve y el cielo y la tierra se mojan entre sí
Se atragantan las alcantarillas
Llueve, llueve y en todos los balcones de Madrid
Se está mojando la ropa tendida
(Si llueve la gente se pone a cubierto)
(Si llueve el pasto se pone contento)
Llueve y parece que mañana va a seguir así
Lo asegura Meteorología
Llueve, llueve en todos los rincones del país
La tierra está agradecida
(Si llueve la gente se pone a cubierto
Y el pasto se pone contento)
Llueve sobre el río
Llueve sobre el mar
Llueve y no parece
Que vaya a parar
Llueve y el cielo y la tierra se tocan entre sí
Se escucha el rugir del aguacero
Llueve, llueve y en todos los rincones del jardín
Se alborotó el hormiguero
(Si llueve la gente se pone a cubierto)
(Si llueve el pasto se pone contento)
Llueve y parece que mañana va a seguir así
Cuando ya ganaba la sequía
Llueve, llueve y en todos los rincones del país
La tierra está humedecida
(Si llueve la gente se pone a cubierto
Y el pasto se pone contento)
Llueve sobre el río
Llueve sobre el mar
Llueve y no parece
Que vaya a parar
";Llueve;https://genius.com/Jorge-drexler-llueve-lyrics
1442612;"(Luigi Tenco)
Lontano lontano nel tempo
Qualche cosa
Negli occhi di un altro
Ti farà ripensare ai miei occhi
I miei occhi che t'amavano tanto
E lontano lontano nel mondo
In un sorriso
Sulle labbra di un altro
Troverai quella mia timidezza
Per cui tu
Mi prendevi un po' in giro
E lontano lontano nel tempo
L'espressione
Di un volto per caso
Ti farà ricordare il mio volto
L'aria triste che tu amavi tanto
E lontano lontano nel mondo
Una sera sarai con un altro
E ad un tratto
Chissà come e perché
Ti troverai a parlargli di me
Di un amore ormai troppo lontano
";Lontano lontano;https://genius.com/Jorge-drexler-lontano-lontano-lyrics
1543325;"Luna del Cabo, boca de túnel
Lunar plateado sobre las nubes
Todos venimos a verte
Venimos de lejos a verte brillar
Blanca, creciente, sacerdotisa
Palideciente sobre Valizas
Nadie se quiere perder
Nadie queda borracho sin verte salir
Roja, redonda, mi cocumela fosforescente
Sobre la arena
Todos se miran perdidos
Se ríen, se mojan la ropa en el mar
";Luna del cabo;https://genius.com/Jorge-drexler-luna-del-cabo-lyrics
1073134;"Cuatro estrellas blancas sobre fondo negro
Es la Cruz del Sur
Cuatro estrellas blancas sobre fondo negro
Es la Cruz del Sur
Una luna negra sobre fondo blanco
Es tu lunar
Y yo no puedo ni mirar el cielo
Sin nombrarte
Yo no puedo ver anochecer
Sin recordarte
Tres Marías blancas van cruzando
Un cielo color carbón
Tres Marías blancas van cruzando
Un cielo color carbón
Tus ojos negros dieron en el blanco
De mi corazón
Y yo tocando el cielo cada vez
Que te miraba
Yo tocando esta canción
Mientras te recordaba
Ue le le, ue le la
Vuela en el viento
Esta canción
Vuela cruzando la noche
Cruzando camino de tu corazón
Vuela en el viento
Esta canción
Vuela cruzando la noche
Cruzando camino de tu corazón
Camino de tu corazón
Cuatro estrellas blancas sobre fondo negro
Es la Cruz del Sur
Cuatro estrellas blancas sobre fondo negro
Es la Cruz del Sur
Una luna negra sobre fondo blanco
Es tu lunar
Y yo no puedo ni mirar el cielo
Sin nombrarte
Yo no puedo ver anochecer
Sin recordarte
Ue le le, ue le la
Vuela en el viento
Esta canción
Vuela cruzando la noche
Cruzando camino de tu corazón
Vuela en el viento
Esta canción
Vuela cruzando la noche
Cruzando camino de tu corazón
Ue le le, ue le la
Camino de tu corazón
";Luna negra;https://genius.com/Jorge-drexler-luna-negra-lyrics
887202;"Ella se pinta con un sylvapen
Dibujándose, dibujándose
Boca postiza, rojo de clavel
Enchastrándose, preguntando
Si queda bien así
Femenina
Ignorándome, ignorándome
Macarena, Macarena
Macarena quiere ser mujer
Ella se mira en su delantal
Contorneándose, contorneándose
Frente al espejo no sabe esperar
Aprendiéndose, aprendiendo
El código sutil
Milenario
Sorprendiéndome, sorprendiéndola
(Una mano en la cintura
La mirada en el espejo
Ella sueña la cadencia
Que le vendrá desde lejos)
Macarena, Macarena
Macarena quiere ser mujer
Todos se miran perdidos
Se ríen, se mojan la ropa en el mar
";Macarena y el espejo;https://genius.com/Jorge-drexler-macarena-y-el-espejo-lyrics
1308043;"La Madre Tierra es madre soltera
Su luna no es de miel
él se marchó hace 2 años
Dejándola en la dulce espera
Y su corazón ya no espera por él
Aún es joven la madre tierra
La flor de la edad
Cruzando el cielo
El pelo al viento
Y el niño en la cadera
Yo me volví al verla pasar
Por el azul
Azul del cielo
Con su vestido del azul del mar
Está en el paro, la madre tierra
Pero sabe pelear
Y algunas noches
Hace suplencias
De camarera
Si la vecina le cuida el chaval…
Mi mesa la atiende la madre tierra
""Ya vamos a cerrar"" -me dice-
Y yo le digo: ""te vi con tu niño
Vivimos en
La misma acera
Si ya te vas, te puedo acompañar""
Por el azul
Azul del cielo
Con su vestido del azul del mar
";Madre Tierra;https://genius.com/Jorge-drexler-madre-tierra-lyrics
3204469;" Letra de ""Mandato""[Verso 1]
Desde lo profundo de los cromosomas
De los asistentes a la discoteca
Un mandato transparente, brota
Como el agua de una fuente, claro
Poderoso aunque silente
Va llenando las copas de vagas promesas
Y aunque no se escuche no hay ni un solo gesto
Ni un solo suspiro, ni un solo segundo
Frente al espejo del baño, rime
Que el mandato no gobierne, viernes
Desde su puesto de mando
En la noche ira encajando las piezas
[Hook]
Todo poderosa sed de tiempo
Viva en cada célula del polen
[Verso 2]
Desde lo profundo de los cromosomas
De los asistentes a la discoteca
Un mandato transparente, brota
Como el agua de una fuente, claro
Poderoso aunque silente
Va llenando las copas de vagas promesas
Y aunque no se escuche no hay ni un solo gesto
Ni un solo suspiro, ni un solo segundo
Frente al espejo del baño, rime
Que el mandato no gobierne, viernes
Desde su puesto de mando
En la noche ira encajando las piezas
[Hook]
Todo poderosa sed de tiempo
Viva en cada célula del polen
Todo poderosa sed de tiempo
Viva en cada célula del polen
Todo poderosa sed de tiempo
(Tienes los ojos de tu)
Tátara-tátara-tátara-tátara-tátara-tátara-buela
Viva en cada célula del polen
Tátara-tátara-tátara-tátara-tátara-tátara-buela
Todo poderosa sed de tiempo
Tátara-tátara-tátara-tátara-tátara-tátara-buela
Viva en cada célula del polen
Tátara-tátara-tátara-tátara-tátara-tátara-buela
Todo poderosa sed de tiempo
Viva en cada célula del polen
Todo poderosa sed de tiempo
Viva en cada célula del polen
Todo poderosa sed de tiempo
Viva en cada célula del polen
";Mandato;https://genius.com/Jorge-drexler-mandato-lyrics
974515;"Para contarte, canto
Quiero que sepas cuánto
Me haces bien
Me haces bien
Me haces bien
Te quiero de mil modos
Te quiero sobre todo
Me haces bien
Me haces bien
Me haces bien
Basta ver el reflejo de tus ojos en los míos
Como se lleva el frío
Para entender
Que el corazón no miente
Que afortunadamente
Me haces bien
Me haces bien
Me haces bien
Para contarte, canto
Quiero que sepas cuánto
Me haces bien
Me haces bien
Me haces bien
Basta ver el reflejo de tus ojos en los míos
Como se lleva el frío
Me haces bien
Me haces bien
Me haces bien
Me haces bien
Me haces bien
Me haces bien
Me haces bien
Me haces bien
";Me haces bien;https://genius.com/Jorge-drexler-me-haces-bien-lyrics
952603;"En la bodega de un barco negrero
Vino el candombe del prisionero
En la memoria del prisionero
Duerme el candombe esperando el cuero
Curando el miedo y el mareo
Curando el golpe del carcelero
Vienen tocando, vienen tocando, vienen tocando
En la bodega de un barco negrero
Las manos vienen golpeando el suelo
Las manos golpeando las manos, golpeando el suelo
Igual que un tambor, madera y cuero
Los das pasan y sólo queda en la oscuridad
Memoria del cuero
Vienen cantando, vienen cantando, vienen cantando
¿Dónde está el cielo, donde está el cielo?
¿Dónde está Dios?… que no lo veo
En la cubierta de un barco carguero
Vino mi abuelo salvando el cuero
Mi abuelo vino en un barco aliado
Cuatro puertos lo rebotaron
Con toda el hambre, con todo el miedo
Con lo que no se llevó el saqueo
Vino escapando, vino escapando, vino escapando
";Memoria del cuero;https://genius.com/Jorge-drexler-memoria-del-cuero-lyrics
993641;"Por cada muro un lamento
En Jerusalén, la dorada
Y mil vidas malgastadas
Por cada mandamiento
Yo soy polvo de tu viento
Y aunque sangro de tu herida
Y cada piedra querida
Guarda mi amor más profundo
No hay una piedra en el mundo
Que valga lo que una vida
Yo soy un moro judío
Que vive con los cristianos
No sé que Dios es el mío
Ni cuales son mis hermanos
No sé que Dios es el mío
Ni cuales son mis hermanos
No hay muerto que no me duela
No hay un bando ganador
No hay nada más que dolor
Y otra vida que se vuela
La guerra es muy mala escuela
No importa el disfraz que viste
Perdonen que no me aliste
Bajo ninguna bandera
Vale más cualquier quimera
Que un trozo de tela triste
Yo soy un moro judío
Que vive con los cristianos
No sé que Dios es el mío
Ni cuales son mis hermanos
No sé que Dios es el mío
Ni cuales son mis hermanos
Y a nadie le dí permiso
Para matar en mi nombre
Un hombre no es más que un hombre
Y si hay Dios, así lo quiso
El mismo suelo que piso
Seguirá, yo me habré ido;
Rumbo también del olvido
No hay doctrina que no vaya
Y no hay pueblo que no se haya
Creído el pueblo elegido
Yo soy un moro judío
Que vive con los cristianos
No sé que Dios es el mío
Ni cuales son mis hermanos
No sé que Dios es el mío
Ni cuales son mis hermanos
Yo soy un moro judío
Que vive con los cristianos
";Milonga Del Moro Judío;https://genius.com/Jorge-drexler-milonga-del-moro-judio-lyrics
1316711;"Milonga de ojos dorados
Cantale a la que yo quiero
Tu corazón compañero
Musical y acompasado
Vaya volando a su lado
Y digale que no puedo vivir
Ella, como vos, tenía
Los ojos color de oro
Mirándolos casi lloro
Vos bien sabés aquel día
Nunca pensé que existía
Una mujer con los ojos así
No digas que ella se ha ido
Decí más bien que algún día
Igual que tu melodía
Cantandome en el oído
Ella sentirá el latido
Del amor que una vez le pedí
Milonga, vos sos testigo
De que la quiero de veras
Vos no tenés sus caderas
Ni aquella boca de trigo
Pero cantando conmigo
Irán tus ojos a hablarle de mí
Milonga de ojos dorados
Volá cantando a buscarla;
Y si llegás a encontrarla
Después de haberla mirado
Entregale enamorado
El corazón que una vez le ofrecí
";Milonga de los ojos dorados;https://genius.com/Jorge-drexler-milonga-de-los-ojos-dorados-lyrics
1385702;"Milonga paraguaya, prima lejana de Mangoré
¿Qué me estará queriendo decir la noche que no lo sé?
¿Qué me estará queriendo decir la noche que no lo sé?
Yo miro a mi guitarra
Busco en las grietas del corazón
Cómo estaré de solo
Que estoy hablándole a una canción
Cómo estaré de solo
Que estoy hablándole a una canción
Pasa un segundo
Como pasa una página en blanco
Que no estrené
Paso la vida
Buscando un verso
Que nunca encontraré
Paso la vida
Buscando un verso
Que nunca encontraré
Cuando me quedé solo
Varado y lejos del mar, yo sé
Que aunque no tenga nada
Tendré a esta copla esperándome
Que aunque no tenga nada
Tendré a esta copla esperándome
Abre tus brazos
Y suéltate el pelo
Que vengo buscándote
Milonga paraguaya
Prima lejana de Mangoré
";Milonga paraguaya;https://genius.com/Jorge-drexler-milonga-paraguaya-lyrics
1774973;"Yo tengo pintada en la piel
A lágrima de esta ciudad
A misma que da de beber
La misma te hará naufragar
Yo tengo en la piel su sabor
Un leve resabio de sal
Que nunca he sabido esconder
Que nunca he sabido mirar
Si dejo elegir a mis pies
Me llevan camino del mar
Me llevan camino del mar
Me llevan camino del mar
El mar que me trajo hasta aquí
El puerto en que habré de zarpar
Un día pensando en volver
Un día volviendo a escapar
Un día cualquiera me iré
Dejando su lágrima atrás
La pena que haga partir
La misma me hará regresar
Si dejo elegir a mis pies
Me llevan camino del mar
Me llevan camino del mar
Me llevan camino del mar
";Montevideo;https://genius.com/Jorge-drexler-montevideo-lyrics
